{
  "code": "25BS1CH101",
  "name": "Chemistry for Engineers",
  "shortName": "CFE",
  "regulation": "R25",
  "semester": "1-1",
  "credits": 3,
  "kb": "kb/data/topics.json",
  "syllabus": "kb/data/syllabus.json",
  "coverage": "kb/data/coverage-audit.json",
  "units": [
    {
      "number": 1,
      "title": "Water and its Treatment",
      "notes": "kb/notes/unit-1.md",
      "publicationStatus": "draft"
    },
    {
      "number": 2,
      "title": "Electrochemistry and Corrosion",
      "notes": "kb/notes/unit-2.md",
      "publicationStatus": "draft",
      "plannedTopicNav": [
        {
          "number": "2.1",
          "title": "Redox Reactions"
        },
        {
          "number": "2.2",
          "title": "Electrode Potential, Standard Electrode Potential & Nernst Equation"
        },
        {
          "number": "2.3",
          "title": "Electrochemical Cell and Galvanic Cell"
        },
        {
          "number": "2.4",
          "title": "EMF of an Electrochemical Cell"
        },
        {
          "number": "2.5",
          "title": "Reference Electrodes and Standard Hydrogen Electrode (SHE)"
        },
        {
          "number": "2.6",
          "title": "Calomel Electrode"
        },
        {
          "number": "2.7",
          "title": "Ion-Selective Electrode and Glass Electrode"
        },
        {
          "number": "2.8",
          "title": "Introduction to Corrosion"
        },
        {
          "number": "2.9",
          "title": "Chemical Corrosion"
        },
        {
          "number": "2.10",
          "title": "Electrochemical Corrosion"
        },
        {
          "number": "2.11",
          "title": "Galvanic Corrosion"
        },
        {
          "number": "2.12",
          "title": "Pitting Corrosion"
        },
        {
          "number": "2.13",
          "title": "Waterline Corrosion"
        },
        {
          "number": "2.14",
          "title": "Factors Affecting the Rate of Corrosion"
        },
        {
          "number": "2.15",
          "title": "Cathodic Protection"
        }
      ]
    },
    {
      "number": 3,
      "title": "Energy Sources and Battery Technology",
      "notes": "kb/notes/unit-3.md",
      "publicationStatus": "scaffold"
    },
    {
      "number": 4,
      "title": "Polymers",
      "notes": "kb/notes/unit-4.md",
      "publicationStatus": "scaffold"
    },
    {
      "number": 5,
      "title": "Spectroscopic Applications and Advanced Functional Materials",
      "notes": "kb/notes/unit-5.md",
      "publicationStatus": "scaffold"
    }
  ],
  "pyqStatus": "not-added-yet",
  "unitRenderer": {
    "syllabusPage": "r25-syllabus.html",
    "sources": [
      {
        "path": "kb/data/source-manifest.json",
        "collection": "syllabus_refs",
        "idField": "source_id",
        "kind": "Syllabus",
        "format": "syllabus"
      },
      {
        "path": "kb/data/book-index.json",
        "idField": "source_id",
        "kind": "Textbook",
        "format": "book-page"
      },
      {
        "path": "kb/data/source-manifest.json",
        "collection": "gap_sources",
        "idField": "id",
        "kind": "Approved source",
        "format": "external"
      }
    ]
  },
  "practice": {
    "unitQuestions": {
      "label": "Textbook Questions",
      "description": "Prescribed textbook questions for each unit.",
      "hrefPattern": "unit-{unit}-questions.html",
      "availableUnits": [],
      "data": "kb/data/textbook-questions.json"
    },
    "pyqs": {
      "label": "CFE PYQs",
      "description": "VNR previous-year questions for Chemistry for Engineers.",
      "href": "pyqs.html",
      "status": "scaffold"
    }
  },
  "classNotes": {
    "label": "Priyanka's Class Notes",
    "description": "Chronological dated Chemistry class notes.",
    "hrefPattern": "unit-{unit}-class-notes.html",
    "availableUnits": [],
    "sourceManifest": "kb/data/source-manifest.json",
    "collection": "class_sources"
  },
  "studyResources": [
    {
      "label": "Revision",
      "title": "End-Sem Revision Notes",
      "description": "Revision notes for preparation before semester-end exams.",
      "href": "end-sem-notes.html",
      "state": "Notes not added yet",
      "action": "View notes collection"
    },
    {
      "practiceKey": "pyqs",
      "label": "Exam practice",
      "title": "VNR PYQs",
      "state": "Papers not added yet",
      "action": "View CFE PYQs"
    }
  ]
}
