{
  "code": "25BS1MT101",
  "name": "Matrices and Calculus",
  "shortName": "MAC",
  "regulation": "R25",
  "semester": "1-1",
  "credits": 4,
  "kb": "kb/data/topics.json",
  "syllabus": "kb/data/syllabus.json",
  "coverage": "kb/data/coverage-audit.json",
  "units": [
    {
      "number": 1,
      "title": "Matrices",
      "notes": "kb/notes/unit-1.md",
      "publicationStatus": "ready"
    },
    {
      "number": 2,
      "title": "Eigenvalues, Eigenvectors and Quadratic Forms",
      "notes": "kb/notes/unit-2.md",
      "publicationStatus": "ready"
    },
    {
      "number": 3,
      "title": "Single Variable Calculus and Curve Tracing",
      "notes": "kb/notes/unit-3.md",
      "publicationStatus": "scaffold"
    },
    {
      "number": 4,
      "title": "Partial Differentiation and Its Applications",
      "notes": "kb/notes/unit-4.md",
      "publicationStatus": "scaffold"
    },
    {
      "number": 5,
      "title": "Multiple Integrals",
      "notes": "kb/notes/unit-5.md",
      "publicationStatus": "scaffold"
    }
  ],
  "pyqStatus": "not-added-yet",
  "unitRenderer": {
    "syllabusPage": "r25-syllabus.html",
    "sources": [
      {
        "path": "kb/data/source-manifest.json",
        "collection": "syllabus_refs",
        "idField": "source_id",
        "kind": "Syllabus",
        "format": "syllabus"
      },
      {
        "path": "kb/data/book-index.json",
        "idField": "source_id",
        "kind": "Textbook",
        "format": "book-page"
      },
      {
        "path": "kb/data/source-manifest.json",
        "collection": "gap_sources",
        "idField": "id",
        "kind": "Approved source",
        "format": "external"
      },
      {
        "path": "kb/data/source-manifest.json",
        "collection": "class_sources",
        "idField": "id",
        "kind": "Class notes",
        "format": "class-log"
      }
    ]
  },
  "practice": {
    "pyqs": {
      "label": "MAC PYQs",
      "description": "VNR previous-year questions for Matrices and Calculus.",
      "href": "pyqs.html",
      "status": "scaffold"
    },
    "unitQuestions": {
      "label": "Textbook Questions",
      "description": "R25-relevant questions from the prescribed Grewal textbook, with complete PankusDesk solutions and printed appendix checks.",
      "hrefPattern": "unit-{unit}-questions.html",
      "availableUnits": [
        1,
        2
      ],
      "data": "kb/data/textbook-questions.json"
    }
  },
  "classNotes": {
    "label": "Priyanka's Class Notes",
    "description": "Chronological dated class notes for each unit, lightly cleaned for grammar while preserving notebook meaning and class-work order.",
    "hrefPattern": "unit-{unit}-class-notes.html",
    "availableUnits": [
      1,
      2
    ],
    "sourceManifest": "kb/data/source-manifest.json",
    "collection": "class_sources"
  },
  "studyResources": [
    {
      "label": "Revision",
      "title": "End-Sem Revision Notes",
      "description": "Revision notes for preparation before semester-end exams.",
      "href": "end-sem-notes.html",
      "state": "Notes not added yet",
      "action": "View notes collection"
    },
    {
      "practiceKey": "pyqs",
      "label": "Exam practice",
      "title": "VNR PYQs",
      "state": "Papers not added yet",
      "action": "View MAC PYQs"
    },
    {
      "label": "Methods",
      "title": "Step-by-step methods",
      "description": "Matrix reductions, Gauss-Jordan, eigenvalue workflows, calculus procedures and integral methods are organised beside the relevant theory.",
      "state": "Growing with the semester"
    },
    {
      "label": "Revision",
      "title": "Formula & theorem sheet",
      "description": "A compact formula and theorem sheet for revision.",
      "state": "Not available yet"
    }
  ]
}
